### ISSUE TITLE
Autogen Agent fails to connect to dbhub over HTTP

### ISSUE THREAD

**Issue by knowonething** [bytebase/dbhub#103]
I created an Agent using Autogen and equipped it with dbhub. I started dbhub using HTTP, but Autogen keeps throwing a `404 not found` error when trying to access it. Has anyone else encountered the same issue?

**Comment by tianzhou** [comment]
The MCP endpoint is at `/message` instead of root '/`

**Comment by knowonething** [comment]
I used tcpdump to examine the interaction between autogen and dbhub/playwright-mcp. I found that before sending the `tools/list` request, autogen first sends several other messages, such as `GET /`. dbhub responds to all of these with `404`, while playwright-mcp provides responses.

**Comment by tianzhou** [comment]
does autogen sends to `/message`?

**Comment by tianzhou** [comment]
Please try version 0.11.6

**Comment by knowonething** [comment]
Sorry, my previous statement might have been inaccurate. I ran the test with version 0.11.6, and here’s the data I captured with tcpdump.

```
tcpdump: verbose output suppressed, use -v[v]... for full protocol decode
listening on lo, link-type EN10MB (Ethernet), snapshot length 262144 bytes
14:50:44.104746 IP localhost.34910 > localhost.51002: Flags [S], seq 1000330573, win 65495, options [mss 65495,sackOK,TS val 496401635 ecr 0,nop,wscale 7], length 0
E..<5.@.@............^.:;..M.........0.........
..|.........
14:50:44.104759 IP localhost.51002 > localhost.34910: Flags [S.], seq 1378464717, ack 1000330574, win 65483, options [mss 65495,sackOK,TS val 496401635 ecr 496401635,nop,wscale 7], length 0
E..<..@.@.<..........:.^R)..;..N.....0.........
..|...|.....
14:50:44.104771 IP localhost.34910 > localhost.51002: Flags [.], ack 1, win 512, options [nop,nop,TS val 496401635 ecr 496401635], length 0
E..45.@.@............^.:;..NR).......(.....
..|...|.
14:50:44.105395 IP localhost.34910 > localhost.51002: Flags [P.], seq 1:190, ack 1, win 512, options [nop,nop,TS val 496401635 ecr 496401635], length 189
E...5.@.@............^.:;..NR).............
..|...|.GET /message HTTP/1.1
Host: localhost:51002
Accept-Encoding: gzip, deflate
Connection: keep-alive
User-Agent: python-httpx/0.28.1
Accept: text/event-stream
Cache-Control: no-store


14:50:44.105432 IP localhost.51002 > localhost.34910: Flags [.], ack 190, win 511, options [nop,nop,TS val 496401635 ecr 496401635], length 0
E..4.|@.@.gE.........:.^R)..;........(.....
..|...|.
14:50:44.107079 IP localhost.51002 > localhost.34910: Flags [P.], seq 1:616, ack 190, win 512, options [nop,nop,TS val 496401637 ecr 496401635], length 615
E....}@.@.d..........:.^R)..;..............
..|...|.HTTP/1.1 404 Not Found
X-Powered-By: Express
Access-Control-Allow-Origin: http://localhost
Access-Control-Allow-Methods: GET, POST, OPTIONS
Access-Control-Allow-Headers: Content-Type, Mcp-Session-Id
Access-Control-Allow-Credentials: true
Content-Security-Policy: default-src 'none'
X-Content-Type-Options: nosniff
Content-Type: text/html; charset=utf-8
Content-Length: 146
Date: Mon, 13 Oct 2025 06:50:44 GMT
Connection: keep-alive
Keep-Alive: timeout=5

<!DOCTYPE html>
<html lang="en">
<head>
<meta charset="utf-8">
<title>Error</title>
</head>
<body>
<pre>Cannot GET /message</pre>
</body>
</html>

14:50:44.107112 IP localhost.34910 > localhost.51002: Flags [.], ack 616, win 508, options [nop,nop,TS val 496401637 ecr 496401637], length 0
E..45.@.@............^.:;...R).5.....(.....
..|...|.
14:50:44.108049 IP localhost.34910 > localhost.51002: Flags [F.], seq 190, ack 616, win 508, options [nop,nop,TS val 496401638 ecr 496401637], length 0
E..45.@.@............^.:;...R).5.....(.....
..|...|.
14:50:44.108596 IP localhost.51002 > localhost.34910: Flags [F.], seq 616, ack 191, win 512, options [nop,nop,TS val 496401639 ecr 496401638], length 0
E..4.~@.@.gC.........:.^R).5;........(.....
..|...|.
14:50:44.108647 IP localhost.34910 > localhost.51002: Flags [.], ack 617, win 508, options [nop,nop,TS val 496401639 ecr 496401639], length 0
E..45.@.@............^.:;...R).6.....(.....
..|...|.
```

It seems that dbhub returned a `404` during the autogen access process. However, VS Code can use the dbhub MCP without any issues. Below is part of the interaction between autogen and playwright-mcp that I captured with tcpdump.

```
tcpdump: verbose output suppressed, use -v[v]... for full protocol decode
listening on lo, link-type EN10MB (Ethernet), snapshot length 262144 bytes
15:03:23.898231 IP localhost.57870 > localhost.3000: Flags [S], seq 323471871, win 65495, options [mss 65495,sackOK,TS val 497163260 ecr 0,nop,wscale 7], length 0
E..<..@.@.+'.............G...........0.........
............
15:03:23.898245 IP localhost.3000 > localhost.57870: Flags [S.], seq 2712492175, ack 323471872, win 65483, options [mss 65495,sackOK,TS val 497163260 ecr 497163260,nop,wscale 7], length 0
E..<..@.@.<...............X..G.......0.........
............
15:03:23.898256 IP localhost.57870 > localhost.3000: Flags [.], ack 1, win 512, options [nop,nop,TS val 497163260 ecr 497163260], length 0
E..4..@.@.+..............G....X......(.....
........
15:03:23.899054 IP localhost.57870 > localhost.3000: Flags [P.], seq 1:185, ack 1, win 512, options [nop,nop,TS val 497163261 ecr 497163260], length 184
E.....@.@.*u.............G....X............
........GET /sse HTTP/1.1
Host: localhost:3000
Accept-Encoding: gzip, deflate
Connection: keep-alive
User-Agent: python-httpx/0.28.1
Accept: text/event-stream
Cache-Control: no-store


15:03:23.899107 IP localhost.3000 > localhost.57870: Flags [.], ack 185, win 511, options [nop,nop,TS val 497163261 ecr 497163261], length 0
E..4kV@.@..k..............X..G.......(.....
........
15:03:23.920432 IP localhost.3000 > localhost.57870: Flags [P.], seq 1:262, ack 185, win 512, options [nop,nop,TS val 497163282 ecr 497163261], length 261
E..9kW@.@..e..............X..G.......-.....
........HTTP/1.1 200 OK
Content-Type: text/event-stream
Cache-Control: no-cache, no-transform
Connection: keep-alive
Date: Mon, 13 Oct 2025 07:03:23 GMT
Transfer-Encoding: chunked

4b
event: endpoint
data: /sse?sessionId=7ce8cf13-8b66-44b9-847e-e8fe3bf4864f



15:03:23.920495 IP localhost.57870 > localhost.3000: Flags [.], ack 262, win 510, options [nop,nop,TS val 497163282 ecr 497163282], length 0
E..4..@.@.+,.............G....Y......(.....
........
15:03:23.922964 IP localhost.57884 > localhost.3000: Flags [S], seq 4261816059, win 65495, options [mss 65495,sackOK,TS val 497163285 ecr 0,nop,wscale 7], length 0
E..<.@@.@. z..............&..........0.........
............
15:03:23.922978 IP localhost.3000 > localhost.57884: Flags [S.], seq 3273223689, ack 4261816060, win 65483, options [mss 65495,sackOK,TS val 497163285 ecr 497163285,nop,wscale 7], length 0
E..<..@.@.<...............n     ..&......0.........
............
15:03:23.922989 IP localhost.57884 > localhost.3000: Flags [.], ack 1, win 512, options [nop,nop,TS val 497163285 ecr 497163285], length 0
E..4.A@.@. ...............&...n
.....(.....
........
15:03:23.923532 IP localhost.57884 > localhost.3000: Flags [P.], seq 1:247, ack 1, win 512, options [nop,nop,TS val 497163285 ecr 497163285], length 246
E..*.B@.@.................&...n
...........
........POST /sse?sessionId=7ce8cf13-8b66-44b9-847e-e8fe3bf4864f HTTP/1.1
Host: localhost:3000
Accept: */*
Accept-Encoding: gzip, deflate
Connection: keep-alive
User-Agent: python-httpx/0.28.1
Content-Length: 165
Content-Type: application/json


15:03:23.923558 IP localhost.3000 > localhost.57884: Flags [.], ack 247, win 510, options [nop,nop,TS val 497163285 ecr 497163285], length 0
E..4<?@.@.................n
..'......(.....
........
15:03:23.923626 IP localhost.57884 > localhost.3000: Flags [P.], seq 247:412, ack 1, win 512, options [nop,nop,TS val 497163285 ecr 497163285], length 165
E....C@.@.................'...n
...........
........{"method":"initialize","params":{"protocolVersion":"2025-06-18","capabilities":{"sampling":{}},"clientInfo":{"name":"mcp","version":"0.1.0"}},"jsonrpc":"2.0","id":0}
15:03:23.923630 IP localhost.3000 > localhost.57884: Flags [.], ack 412, win 509, options [nop,nop,TS val 497163286 ecr 497163285], length 0
E..4<@@.@.................n
..(......(.....
........
15:03:23.932453 IP localhost.3000 > localhost.57884: Flags [P.], seq 1:156, ack 412, win 512, options [nop,nop,TS val 497163294 ecr 497163285], length 155
E...<A@.@.................n
..(............
........HTTP/1.1 202 Accepted
Date: Mon, 13 Oct 2025 07:03:23 GMT
Connection: keep-alive
Keep-Alive: timeout=5
Transfer-Encoding: chunked

8
Accepted
0


15:03:23.932522 IP localhost.57884 > localhost.3000: Flags [.], ack 156, win 511, options [nop,nop,TS val 497163294 ecr 497163294], length 0
E..4.D@.@. ~..............(...n......(.....
........
15:03:23.933311 IP localhost.3000 > localhost.57870: Flags [P.], seq 262:439, ack 185, win 512, options [nop,nop,TS val 497163295 ecr 497163282], length 177
E...kX@.@.................Y..G.............
........ab
event: message
data: {"result":{"protocolVersion":"2025-06-18","capabilities":{"tools":{}},"serverInfo":{"name":"Playwright","version":"0.0.42"}},"jsonrpc":"2.0","id":0}



15:03:23.933320 IP localhost.57870 > localhost.3000: Flags [.], ack 439, win 509, options [nop,nop,TS val 497163295 ecr 497163295], length 0
E..4..@.@.++.............G....ZF.....(.....
........
15:03:23.935569 IP localhost.57884 > localhost.3000: Flags [P.], seq 412:657, ack 156, win 512, options [nop,nop,TS val 497163297 ecr 497163294], length 245
E..).E@.@.................(...n............
...!....POST /sse?sessionId=7ce8cf13-8b66-44b9-847e-e8fe3bf4864f HTTP/1.1
Host: localhost:3000
Accept: */*
Accept-Encoding: gzip, deflate
Connection: keep-alive
User-Agent: python-httpx/0.28.1
Content-Length: 54
Content-Type: application/json


15:03:23.935682 IP localhost.57884 > localhost.3000: Flags [P.], seq 657:711, ack 156, win 512, options [nop,nop,TS val 497163298 ecr 497163294], length 54
E..j.F@.@. F..............)...n......^.....
..."....{"method":"notifications/initialized","jsonrpc":"2.0"}
15:03:23.935761 IP localhost.3000 > localhost.57884: Flags [.], ack 711, win 512, options [nop,nop,TS val 497163298 ecr 497163297], length 0
E..4<B@.@.................n...)......(.....
..."...!
15:03:23.938343 IP localhost.3000 > localhost.57884: Flags [P.], seq 156:311, ack 711, win 512, options [nop,nop,TS val 497163300 ecr 497163297], length 155
E...<C@.@.................n...)............
...$...!HTTP/1.1 202 Accepted
Date: Mon, 13 Oct 2025 07:03:23 GMT
Connection: keep-alive
Keep-Alive: timeout=5
Transfer-Encoding: chunked

8
Accepted
0


15:03:23.939530 IP localhost.57884 > localhost.3000: Flags [P.], seq 711:956, ack 311, win 512, options [nop,nop,TS val 497163301 ecr 497163300], length 245
E..).G@.@.................)...o@...........
...%...$POST /sse?sessionId=7ce8cf13-8b66-44b9-847e-e8fe3bf4864f HTTP/1.1
Host: localhost:3000
Accept: */*
Accept-Encoding: gzip, deflate
Connection: keep-alive
User-Agent: python-httpx/0.28.1
Content-Length: 46
Content-Type: application/json


15:03:23.939634 IP localhost.57884 > localhost.3000: Flags [P.], seq 956:1002, ack 311, win 512, options [nop,nop,TS val 497163302 ecr 497163300], length 46
E..b.H@.@. L..............*...o@.....V.....
...&...${"method":"tools/list","jsonrpc":"2.0","id":1}
15:03:23.939707 IP localhost.3000 > localhost.57884: Flags [.], ack 1002, win 512, options [nop,nop,TS val 497163302 ecr 497163301], length 0
E..4<D@.@..~..............o@..*......(.....
...&...%
15:03:23.945972 IP localhost.3000 > localhost.57884: Flags [P.], seq 311:466, ack 1002, win 512, options [nop,nop,TS val 497163308 ecr 497163301], length 155
E...<E@.@.................o@..*............
...,...%HTTP/1.1 202 Accepted
Date: Mon, 13 Oct 2025 07:03:23 GMT
Connection: keep-alive
Keep-Alive: timeout=5
Transfer-Encoding: chunked
```

Could it be that autogen implements its own mechanism instead of following the MCP protocol specifications?

**Comment by tianzhou** [comment]
I am not familiar with Autogen, you may post the question in their community
